{
  "schema": "efh.battery/v1",
  "function_id": "FUNC.FLOOR.MATH",
  "surface_name": "FLOOR.MATH",
  "battery_id": "EFH-B1",
  "oxfunc_commit": "473efa37db60e565ce04241d7cedf74fb3227777",
  "oxfunc_tree_clean": true,
  "runner_version": "efh-battery/0.1.0",
  "host": {
    "arch": "x86_64",
    "cpu": "AMD64 Family 23 Model 96 Stepping 1, AuthenticAMD",
    "os": "windows"
  },
  "rows": [
    {
      "label": "zero",
      "input_display": "FLOOR.MATH(0)",
      "outcome_kind": "number",
      "outcome_display": "0.0000000000000000e0",
      "outcome_bits": "0x0000000000000000",
      "host_scoped": false
    },
    {
      "label": "negative-one",
      "input_display": "FLOOR.MATH(-1)",
      "outcome_kind": "number",
      "outcome_display": "-1.0000000000000000e0",
      "outcome_bits": "0xbff0000000000000",
      "host_scoped": false
    },
    {
      "label": "empty-string",
      "input_display": "FLOOR.MATH(\"\")",
      "outcome_kind": "error",
      "outcome_display": "#VALUE!",
      "outcome_bits": null,
      "host_scoped": false
    },
    {
      "label": "boolean-true",
      "input_display": "FLOOR.MATH(TRUE)",
      "outcome_kind": "number",
      "outcome_display": "1.0000000000000000e0",
      "outcome_bits": "0x3ff0000000000000",
      "host_scoped": false
    },
    {
      "label": "empty-range",
      "input_display": "FLOOR.MATH(<empty>)",
      "outcome_kind": "error",
      "outcome_display": "#VALUE!",
      "outcome_bits": null,
      "host_scoped": false
    },
    {
      "label": "error-na",
      "input_display": "FLOOR.MATH(#N/A)",
      "outcome_kind": "error",
      "outcome_display": "#N/A",
      "outcome_bits": null,
      "host_scoped": false
    },
    {
      "label": "max-double",
      "input_display": "FLOOR.MATH(1.7976931348623157e308)",
      "outcome_kind": "number",
      "outcome_display": "1.7976931348623157e308",
      "outcome_bits": "0x7fefffffffffffff",
      "host_scoped": false
    },
    {
      "label": "min-subnormal",
      "input_display": "FLOOR.MATH(4.9406564584124654e-324)",
      "outcome_kind": "number",
      "outcome_display": "0.0000000000000000e0",
      "outcome_bits": "0x0000000000000000",
      "host_scoped": false
    },
    {
      "label": "inline-array",
      "input_display": "FLOOR.MATH({1,2;3,4})",
      "outcome_kind": "array",
      "outcome_display": "{1.0000000000000000e0,2.0000000000000000e0;3.0000000000000000e0,4.0000000000000000e0}",
      "outcome_bits": null,
      "host_scoped": false
    },
    {
      "label": "text-numeral",
      "input_display": "FLOOR.MATH(\"2.5\")",
      "outcome_kind": "number",
      "outcome_display": "2.0000000000000000e0",
      "outcome_bits": "0x4000000000000000",
      "host_scoped": false
    },
    {
      "label": "too-few-args",
      "input_display": "FLOOR.MATH()",
      "outcome_kind": "refused-by-arity",
      "outcome_display": "#VALUE!",
      "outcome_bits": null,
      "host_scoped": false
    },
    {
      "label": "too-many-args",
      "input_display": "FLOOR.MATH(1, 1, 1, 1)",
      "outcome_kind": "refused-by-arity",
      "outcome_display": "#VALUE!",
      "outcome_bits": null,
      "host_scoped": false
    }
  ],
  "label": "OxFunc's own answers. No Excel was involved."
}
