{
  "schema": "efh.battery/v1",
  "function_id": "FUNC.CONFIDENCE",
  "surface_name": "CONFIDENCE",
  "battery_id": "EFH-B1",
  "oxfunc_commit": "473efa37db60e565ce04241d7cedf74fb3227777",
  "oxfunc_tree_clean": true,
  "runner_version": "efh-battery/0.1.0",
  "host": {
    "arch": "x86_64",
    "cpu": "AMD64 Family 23 Model 96 Stepping 1, AuthenticAMD",
    "os": "windows"
  },
  "rows": [
    {
      "label": "zero",
      "input_display": "CONFIDENCE(0, 0, 0)",
      "outcome_kind": "error",
      "outcome_display": "#NUM!",
      "outcome_bits": null,
      "host_scoped": false
    },
    {
      "label": "negative-one",
      "input_display": "CONFIDENCE(-1, -1, -1)",
      "outcome_kind": "error",
      "outcome_display": "#NUM!",
      "outcome_bits": null,
      "host_scoped": false
    },
    {
      "label": "empty-string",
      "input_display": "CONFIDENCE(\"\", \"\", \"\")",
      "outcome_kind": "error",
      "outcome_display": "#VALUE!",
      "outcome_bits": null,
      "host_scoped": false
    },
    {
      "label": "boolean-true",
      "input_display": "CONFIDENCE(TRUE, TRUE, TRUE)",
      "outcome_kind": "error",
      "outcome_display": "#NUM!",
      "outcome_bits": null,
      "host_scoped": false
    },
    {
      "label": "empty-range",
      "input_display": "CONFIDENCE(<empty>, <empty>, <empty>)",
      "outcome_kind": "error",
      "outcome_display": "#VALUE!",
      "outcome_bits": null,
      "host_scoped": false
    },
    {
      "label": "error-na",
      "input_display": "CONFIDENCE(#N/A, #N/A, #N/A)",
      "outcome_kind": "error",
      "outcome_display": "#N/A",
      "outcome_bits": null,
      "host_scoped": false
    },
    {
      "label": "max-double",
      "input_display": "CONFIDENCE(1.7976931348623157e308, 1.7976931348623157e308, 1.7976931348623157e308)",
      "outcome_kind": "error",
      "outcome_display": "#NUM!",
      "outcome_bits": null,
      "host_scoped": false
    },
    {
      "label": "min-subnormal",
      "input_display": "CONFIDENCE(4.9406564584124654e-324, 4.9406564584124654e-324, 4.9406564584124654e-324)",
      "outcome_kind": "error",
      "outcome_display": "#NUM!",
      "outcome_bits": null,
      "host_scoped": false
    },
    {
      "label": "inline-array",
      "input_display": "CONFIDENCE({1,2;3,4}, {1,2;3,4}, {1,2;3,4})",
      "outcome_kind": "array",
      "outcome_display": "{#NUM!,#NUM!;#NUM!,#NUM!}",
      "outcome_bits": null,
      "host_scoped": false
    },
    {
      "label": "text-numeral",
      "input_display": "CONFIDENCE(\"2.5\", \"2.5\", \"2.5\")",
      "outcome_kind": "error",
      "outcome_display": "#NUM!",
      "outcome_bits": null,
      "host_scoped": false
    },
    {
      "label": "too-few-args",
      "input_display": "CONFIDENCE(1, 1)",
      "outcome_kind": "refused-by-arity",
      "outcome_display": "#VALUE!",
      "outcome_bits": null,
      "host_scoped": false
    },
    {
      "label": "too-many-args",
      "input_display": "CONFIDENCE(1, 1, 1, 1)",
      "outcome_kind": "refused-by-arity",
      "outcome_display": "#VALUE!",
      "outcome_bits": null,
      "host_scoped": false
    }
  ],
  "label": "OxFunc's own answers. No Excel was involved."
}
