{
  "schema": "efh.battery/v1",
  "function_id": "FUNC.PERCENTRANK",
  "surface_name": "PERCENTRANK",
  "battery_id": "EFH-B1",
  "oxfunc_commit": "473efa37db60e565ce04241d7cedf74fb3227777",
  "oxfunc_tree_clean": true,
  "runner_version": "efh-battery/0.1.0",
  "host": {
    "arch": "x86_64",
    "cpu": "AMD64 Family 23 Model 96 Stepping 1, AuthenticAMD",
    "os": "windows"
  },
  "rows": [
    {
      "label": "zero",
      "input_display": "PERCENTRANK(0, 0)",
      "outcome_kind": "number",
      "outcome_display": "nan",
      "outcome_bits": "0xfff8000000000000",
      "host_scoped": true
    },
    {
      "label": "negative-one",
      "input_display": "PERCENTRANK(-1, -1)",
      "outcome_kind": "number",
      "outcome_display": "nan",
      "outcome_bits": "0xfff8000000000000",
      "host_scoped": true
    },
    {
      "label": "empty-string",
      "input_display": "PERCENTRANK(\"\", \"\")",
      "outcome_kind": "error",
      "outcome_display": "#VALUE!",
      "outcome_bits": null,
      "host_scoped": false
    },
    {
      "label": "boolean-true",
      "input_display": "PERCENTRANK(TRUE, TRUE)",
      "outcome_kind": "error",
      "outcome_display": "#N/A",
      "outcome_bits": null,
      "host_scoped": false
    },
    {
      "label": "empty-range",
      "input_display": "PERCENTRANK(<empty>, <empty>)",
      "outcome_kind": "error",
      "outcome_display": "#VALUE!",
      "outcome_bits": null,
      "host_scoped": false
    },
    {
      "label": "error-na",
      "input_display": "PERCENTRANK(#N/A, #N/A)",
      "outcome_kind": "error",
      "outcome_display": "#N/A",
      "outcome_bits": null,
      "host_scoped": false
    },
    {
      "label": "max-double",
      "input_display": "PERCENTRANK(1.7976931348623157e308, 1.7976931348623157e308)",
      "outcome_kind": "number",
      "outcome_display": "nan",
      "outcome_bits": "0xfff8000000000000",
      "host_scoped": true
    },
    {
      "label": "min-subnormal",
      "input_display": "PERCENTRANK(4.9406564584124654e-324, 4.9406564584124654e-324)",
      "outcome_kind": "number",
      "outcome_display": "nan",
      "outcome_bits": "0xfff8000000000000",
      "host_scoped": true
    },
    {
      "label": "inline-array",
      "input_display": "PERCENTRANK({1,2;3,4}, {1,2;3,4})",
      "outcome_kind": "array",
      "outcome_display": "{0.0000000000000000e0,3.3300000000000002e-1;6.6600000000000004e-1,1.0000000000000000e0}",
      "outcome_bits": null,
      "host_scoped": false
    },
    {
      "label": "text-numeral",
      "input_display": "PERCENTRANK(\"2.5\", \"2.5\")",
      "outcome_kind": "error",
      "outcome_display": "#N/A",
      "outcome_bits": null,
      "host_scoped": false
    },
    {
      "label": "too-few-args",
      "input_display": "PERCENTRANK(1)",
      "outcome_kind": "refused-by-arity",
      "outcome_display": "#VALUE!",
      "outcome_bits": null,
      "host_scoped": false
    },
    {
      "label": "too-many-args",
      "input_display": "PERCENTRANK(1, 1, 1, 1)",
      "outcome_kind": "refused-by-arity",
      "outcome_display": "#VALUE!",
      "outcome_bits": null,
      "host_scoped": false
    }
  ],
  "label": "OxFunc's own answers. No Excel was involved."
}
