{
  "schema": "efh.battery/v1",
  "function_id": "FUNC.FTEST",
  "surface_name": "FTEST",
  "battery_id": "EFH-B1",
  "oxfunc_commit": "473efa37db60e565ce04241d7cedf74fb3227777",
  "oxfunc_tree_clean": true,
  "runner_version": "efh-battery/0.1.0",
  "host": {
    "arch": "x86_64",
    "cpu": "AMD64 Family 23 Model 96 Stepping 1, AuthenticAMD",
    "os": "windows"
  },
  "rows": [
    {
      "label": "zero",
      "input_display": "FTEST(0, 0)",
      "outcome_kind": "error",
      "outcome_display": "#DIV/0!",
      "outcome_bits": null,
      "host_scoped": false
    },
    {
      "label": "negative-one",
      "input_display": "FTEST(-1, -1)",
      "outcome_kind": "error",
      "outcome_display": "#DIV/0!",
      "outcome_bits": null,
      "host_scoped": false
    },
    {
      "label": "empty-string",
      "input_display": "FTEST(\"\", \"\")",
      "outcome_kind": "error",
      "outcome_display": "#VALUE!",
      "outcome_bits": null,
      "host_scoped": false
    },
    {
      "label": "boolean-true",
      "input_display": "FTEST(TRUE, TRUE)",
      "outcome_kind": "error",
      "outcome_display": "#VALUE!",
      "outcome_bits": null,
      "host_scoped": false
    },
    {
      "label": "empty-range",
      "input_display": "FTEST(<empty>, <empty>)",
      "outcome_kind": "error",
      "outcome_display": "#VALUE!",
      "outcome_bits": null,
      "host_scoped": false
    },
    {
      "label": "error-na",
      "input_display": "FTEST(#N/A, #N/A)",
      "outcome_kind": "error",
      "outcome_display": "#N/A",
      "outcome_bits": null,
      "host_scoped": false
    },
    {
      "label": "max-double",
      "input_display": "FTEST(1.7976931348623157e308, 1.7976931348623157e308)",
      "outcome_kind": "error",
      "outcome_display": "#DIV/0!",
      "outcome_bits": null,
      "host_scoped": false
    },
    {
      "label": "min-subnormal",
      "input_display": "FTEST(4.9406564584124654e-324, 4.9406564584124654e-324)",
      "outcome_kind": "error",
      "outcome_display": "#DIV/0!",
      "outcome_bits": null,
      "host_scoped": false
    },
    {
      "label": "inline-array",
      "input_display": "FTEST({1,2;3,4}, {1,2;3,4})",
      "outcome_kind": "number",
      "outcome_display": "9.9999999999999978e-1",
      "outcome_bits": "0x3feffffffffffffe",
      "host_scoped": true
    },
    {
      "label": "text-numeral",
      "input_display": "FTEST(\"2.5\", \"2.5\")",
      "outcome_kind": "error",
      "outcome_display": "#VALUE!",
      "outcome_bits": null,
      "host_scoped": false
    },
    {
      "label": "too-few-args",
      "input_display": "FTEST(1)",
      "outcome_kind": "refused-by-arity",
      "outcome_display": "#VALUE!",
      "outcome_bits": null,
      "host_scoped": false
    },
    {
      "label": "too-many-args",
      "input_display": "FTEST(1, 1, 1)",
      "outcome_kind": "refused-by-arity",
      "outcome_display": "#VALUE!",
      "outcome_bits": null,
      "host_scoped": false
    }
  ],
  "label": "OxFunc's own answers. No Excel was involved."
}
