{
  "schema": "efh.battery/v1",
  "function_id": "FUNC.CHISQ.INV",
  "surface_name": "CHISQ.INV",
  "battery_id": "EFH-B1",
  "oxfunc_commit": "473efa37db60e565ce04241d7cedf74fb3227777",
  "oxfunc_tree_clean": true,
  "runner_version": "efh-battery/0.1.0",
  "host": {
    "arch": "x86_64",
    "cpu": "AMD64 Family 23 Model 96 Stepping 1, AuthenticAMD",
    "os": "windows"
  },
  "rows": [
    {
      "label": "zero",
      "input_display": "CHISQ.INV(0, 0)",
      "outcome_kind": "error",
      "outcome_display": "#NUM!",
      "outcome_bits": null,
      "host_scoped": false
    },
    {
      "label": "negative-one",
      "input_display": "CHISQ.INV(-1, -1)",
      "outcome_kind": "error",
      "outcome_display": "#NUM!",
      "outcome_bits": null,
      "host_scoped": false
    },
    {
      "label": "empty-string",
      "input_display": "CHISQ.INV(\"\", \"\")",
      "outcome_kind": "error",
      "outcome_display": "#VALUE!",
      "outcome_bits": null,
      "host_scoped": false
    },
    {
      "label": "boolean-true",
      "input_display": "CHISQ.INV(TRUE, TRUE)",
      "outcome_kind": "error",
      "outcome_display": "#NUM!",
      "outcome_bits": null,
      "host_scoped": false
    },
    {
      "label": "empty-range",
      "input_display": "CHISQ.INV(<empty>, <empty>)",
      "outcome_kind": "error",
      "outcome_display": "#VALUE!",
      "outcome_bits": null,
      "host_scoped": false
    },
    {
      "label": "error-na",
      "input_display": "CHISQ.INV(#N/A, #N/A)",
      "outcome_kind": "error",
      "outcome_display": "#N/A",
      "outcome_bits": null,
      "host_scoped": false
    },
    {
      "label": "max-double",
      "input_display": "CHISQ.INV(1.7976931348623157e308, 1.7976931348623157e308)",
      "outcome_kind": "error",
      "outcome_display": "#NUM!",
      "outcome_bits": null,
      "host_scoped": false
    },
    {
      "label": "min-subnormal",
      "input_display": "CHISQ.INV(4.9406564584124654e-324, 4.9406564584124654e-324)",
      "outcome_kind": "error",
      "outcome_display": "#NUM!",
      "outcome_bits": null,
      "host_scoped": false
    },
    {
      "label": "inline-array",
      "input_display": "CHISQ.INV({1,2;3,4}, {1,2;3,4})",
      "outcome_kind": "error",
      "outcome_display": "#VALUE!",
      "outcome_bits": null,
      "host_scoped": false
    },
    {
      "label": "text-numeral",
      "input_display": "CHISQ.INV(\"2.5\", \"2.5\")",
      "outcome_kind": "error",
      "outcome_display": "#NUM!",
      "outcome_bits": null,
      "host_scoped": false
    },
    {
      "label": "too-few-args",
      "input_display": "CHISQ.INV(1)",
      "outcome_kind": "refused-by-arity",
      "outcome_display": "#VALUE!",
      "outcome_bits": null,
      "host_scoped": false
    },
    {
      "label": "too-many-args",
      "input_display": "CHISQ.INV(1, 1, 1)",
      "outcome_kind": "refused-by-arity",
      "outcome_display": "#VALUE!",
      "outcome_bits": null,
      "host_scoped": false
    }
  ],
  "label": "OxFunc's own answers. No Excel was involved."
}
