{
  "schema": "efh.battery/v1",
  "function_id": "FUNC.CUBEVALUE",
  "surface_name": "CUBEVALUE",
  "battery_id": "EFH-B1",
  "oxfunc_commit": "473efa37db60e565ce04241d7cedf74fb3227777",
  "oxfunc_tree_clean": true,
  "runner_version": "efh-battery/0.1.0",
  "host": {
    "arch": "x86_64",
    "cpu": "AMD64 Family 23 Model 96 Stepping 1, AuthenticAMD",
    "os": "windows"
  },
  "rows": [
    {
      "label": "zero",
      "input_display": "CUBEVALUE()",
      "outcome_kind": "not-dispatchable",
      "outcome_display": "cannot-call:not-in-reference-catalog",
      "outcome_bits": null,
      "host_scoped": false
    },
    {
      "label": "negative-one",
      "input_display": "CUBEVALUE()",
      "outcome_kind": "not-dispatchable",
      "outcome_display": "cannot-call:not-in-reference-catalog",
      "outcome_bits": null,
      "host_scoped": false
    },
    {
      "label": "empty-string",
      "input_display": "CUBEVALUE()",
      "outcome_kind": "not-dispatchable",
      "outcome_display": "cannot-call:not-in-reference-catalog",
      "outcome_bits": null,
      "host_scoped": false
    },
    {
      "label": "boolean-true",
      "input_display": "CUBEVALUE()",
      "outcome_kind": "not-dispatchable",
      "outcome_display": "cannot-call:not-in-reference-catalog",
      "outcome_bits": null,
      "host_scoped": false
    },
    {
      "label": "empty-range",
      "input_display": "CUBEVALUE()",
      "outcome_kind": "not-dispatchable",
      "outcome_display": "cannot-call:not-in-reference-catalog",
      "outcome_bits": null,
      "host_scoped": false
    },
    {
      "label": "error-na",
      "input_display": "CUBEVALUE()",
      "outcome_kind": "not-dispatchable",
      "outcome_display": "cannot-call:not-in-reference-catalog",
      "outcome_bits": null,
      "host_scoped": false
    },
    {
      "label": "max-double",
      "input_display": "CUBEVALUE()",
      "outcome_kind": "not-dispatchable",
      "outcome_display": "cannot-call:not-in-reference-catalog",
      "outcome_bits": null,
      "host_scoped": false
    },
    {
      "label": "min-subnormal",
      "input_display": "CUBEVALUE()",
      "outcome_kind": "not-dispatchable",
      "outcome_display": "cannot-call:not-in-reference-catalog",
      "outcome_bits": null,
      "host_scoped": false
    },
    {
      "label": "inline-array",
      "input_display": "CUBEVALUE()",
      "outcome_kind": "not-dispatchable",
      "outcome_display": "cannot-call:not-in-reference-catalog",
      "outcome_bits": null,
      "host_scoped": false
    },
    {
      "label": "text-numeral",
      "input_display": "CUBEVALUE()",
      "outcome_kind": "not-dispatchable",
      "outcome_display": "cannot-call:not-in-reference-catalog",
      "outcome_bits": null,
      "host_scoped": false
    },
    {
      "label": "too-few-args",
      "input_display": "CUBEVALUE()",
      "outcome_kind": "not-dispatchable",
      "outcome_display": "cannot-call:not-in-reference-catalog",
      "outcome_bits": null,
      "host_scoped": false
    },
    {
      "label": "too-many-args",
      "input_display": "CUBEVALUE(1)",
      "outcome_kind": "not-dispatchable",
      "outcome_display": "cannot-call:not-in-reference-catalog",
      "outcome_bits": null,
      "host_scoped": false
    }
  ],
  "label": "OxFunc's own answers. No Excel was involved."
}
